<?xml version="1.0" encoding="UTF-8" ?>

<public_objective xmlns="http://se2018.polimi.it/public_objective"
                  xmlns:xsi="http://www.w3.org/2001/XMLSchema-instance"
                  xsi:schemaLocation="http://se2018.polimi.it/public_objective  ../public_objective.xsd">

    <name>Row Color Variety</name>
    <description>Rows with no repeated colors</description>
    <victoryPoints>6</victoryPoints>
    <otherInformation>
        <noParam>
            <worksOn>colour</worksOn>
            <strategy>Row</strategy>
        </noParam>
    </otherInformation>

</public_objective>
