<?xml version="1.0" encoding="UTF-8" ?>

<public_objective xmlns="http://se2018.polimi.it/public_objective"
                  xmlns:xsi="http://www.w3.org/2001/XMLSchema-instance"
                  xsi:schemaLocation="http://se2018.polimi.it/public_objective  public_objective.xsd">

    <name>Shade Variety</name>
    <description>Sets of one of each value anywhere</description>
    <victoryPoints>5</victoryPoints>
    <otherInformation>
        <withParam>
            <valueGrid>
                <worksOn>value</worksOn>
                <strategy>Grid</strategy>
                <colourArray>1 2 3 4 5 6</colourArray>
            </valueGrid>
        </withParam>
    </otherInformation>

</public_objective>